{
  "schema_version": 1,
  "content_free": true,
  "source_root": "/etc/telegram-userbot/secrets",
  "files": [
    {
      "id": "telegram_api_id",
      "filename": "telegram_api_id",
      "services": [
        "app"
      ],
      "expected_uid": 0,
      "expected_gid": 21001,
      "mode": "0440",
      "max_bytes": 32
    },
    {
      "id": "telegram_api_hash",
      "filename": "telegram_api_hash",
      "services": [
        "app"
      ],
      "expected_uid": 0,
      "expected_gid": 21001,
      "mode": "0440",
      "max_bytes": 256
    },
    {
      "id": "control_bot_token",
      "filename": "control_bot_token",
      "services": [
        "control"
      ],
      "expected_uid": 0,
      "expected_gid": 21002,
      "mode": "0440",
      "max_bytes": 256
    },
    {
      "id": "credential_master_keyring",
      "filename": "credential_master_keyring",
      "services": [
        "app",
        "control",
        "worker"
      ],
      "expected_uid": 0,
      "expected_gid": 21003,
      "mode": "0440",
      "max_bytes": 65536
    },
    {
      "id": "app_database_password",
      "filename": "app_database_password",
      "services": [
        "app",
        "postgres-bootstrap"
      ],
      "expected_uid": 0,
      "expected_gid": 21004,
      "mode": "0440",
      "max_bytes": 128
    },
    {
      "id": "control_database_password",
      "filename": "control_database_password",
      "services": [
        "control",
        "postgres-bootstrap"
      ],
      "expected_uid": 0,
      "expected_gid": 21005,
      "mode": "0440",
      "max_bytes": 128
    },
    {
      "id": "worker_database_password",
      "filename": "worker_database_password",
      "services": [
        "worker",
        "postgres-bootstrap"
      ],
      "expected_uid": 0,
      "expected_gid": 21006,
      "mode": "0440",
      "max_bytes": 128
    },
    {
      "id": "migrator_database_password",
      "filename": "migrator_database_password",
      "services": [
        "migrate",
        "postgres-bootstrap"
      ],
      "expected_uid": 0,
      "expected_gid": 21007,
      "mode": "0440",
      "max_bytes": 128
    },
    {
      "id": "postgres_database_password",
      "filename": "postgres_database_password",
      "services": [
        "postgres-bootstrap"
      ],
      "expected_uid": 0,
      "expected_gid": 21008,
      "mode": "0440",
      "max_bytes": 128
    },
    {
      "id": "redis_password",
      "filename": "redis_password",
      "services": [
        "app",
        "control",
        "worker",
        "redis"
      ],
      "expected_uid": 0,
      "expected_gid": 21009,
      "mode": "0440",
      "max_bytes": 128
    },
    {
      "id": "erasure_hmac_key",
      "filename": "erasure_hmac_key",
      "services": [
        "app",
        "worker",
        "erasure-ledger-export"
      ],
      "expected_uid": 0,
      "expected_gid": 21010,
      "mode": "0440",
      "max_bytes": 4096
    },
    {
      "id": "export_database_password",
      "filename": "export_database_password",
      "services": [
        "data-export",
        "erasure-ledger-export",
        "postgres-bootstrap"
      ],
      "expected_uid": 0,
      "expected_gid": 21011,
      "mode": "0440",
      "max_bytes": 128
    },
    {
      "id": "export_actor_hmac_key",
      "filename": "export_actor_hmac_key",
      "services": [
        "control"
      ],
      "expected_uid": 0,
      "expected_gid": 21012,
      "mode": "0440",
      "max_bytes": 128
    },
    {
      "id": "pgbackrest_s3_access_key",
      "filename": "pgbackrest_s3_access_key",
      "services": [
        "postgres"
      ],
      "expected_uid": 0,
      "expected_gid": 21013,
      "mode": "0440",
      "max_bytes": 256
    },
    {
      "id": "pgbackrest_s3_secret_key",
      "filename": "pgbackrest_s3_secret_key",
      "services": [
        "postgres"
      ],
      "expected_uid": 0,
      "expected_gid": 21013,
      "mode": "0440",
      "max_bytes": 256
    },
    {
      "id": "pgbackrest_repo_cipher_pass",
      "filename": "pgbackrest_repo_cipher_pass",
      "services": [
        "postgres"
      ],
      "expected_uid": 0,
      "expected_gid": 21013,
      "mode": "0440",
      "max_bytes": 256
    },
    {
      "id": "session_restic_password",
      "filename": "session_restic_password",
      "services": [
        "session-backup"
      ],
      "expected_uid": 0,
      "expected_gid": 21014,
      "mode": "0440",
      "max_bytes": 256
    },
    {
      "id": "session_s3_access_key",
      "filename": "session_s3_access_key",
      "services": [
        "session-backup"
      ],
      "expected_uid": 0,
      "expected_gid": 21014,
      "mode": "0440",
      "max_bytes": 256
    },
    {
      "id": "session_s3_secret_key",
      "filename": "session_s3_secret_key",
      "services": [
        "session-backup"
      ],
      "expected_uid": 0,
      "expected_gid": 21014,
      "mode": "0440",
      "max_bytes": 256
    },
    {
      "id": "monitor_database_password",
      "filename": "monitor_database_password",
      "services": [
        "ops-monitor",
        "postgres-bootstrap"
      ],
      "expected_uid": 0,
      "expected_gid": 21017,
      "mode": "0440",
      "max_bytes": 128
    },
    {
      "id": "erasure_restic_password",
      "filename": "erasure_restic_password",
      "services": [
        "erasure-ledger-export"
      ],
      "expected_uid": 0,
      "expected_gid": 21018,
      "mode": "0440",
      "max_bytes": 256
    },
    {
      "id": "erasure_s3_access_key",
      "filename": "erasure_s3_access_key",
      "services": [
        "erasure-ledger-export"
      ],
      "expected_uid": 0,
      "expected_gid": 21018,
      "mode": "0440",
      "max_bytes": 256
    },
    {
      "id": "erasure_s3_secret_key",
      "filename": "erasure_s3_secret_key",
      "services": [
        "erasure-ledger-export"
      ],
      "expected_uid": 0,
      "expected_gid": 21018,
      "mode": "0440",
      "max_bytes": 256
    }
  ]
}
